<?xml version="1.0" encoding="UTF-8" standalone="no"?>
<!DOCTYPE daemon SYSTEM "ArchiveDaemon.dtd">
<daemon>
    <port>4900</port>
    <engine directory='llrf'>
        <desc>LLRF</desc>
        <port>4901</port>
        <config>llrf-group.xml</config>
        <restart>
            <period type='weekly'>We 10:20</period>
            <action>echo Updated index</action>
        </restart>
        <dataserver><host>web2</host></dataserver>
    </engine>
    <!-- Typically, more entries follow:
    <engine directory='hprf'>
        ...
    </engine>
     -->
</daemon>

